{"$id":"urn:lima:v4:lima.audit-evidence-package","$schema":"https://json-schema.org/draft/2020-12/schema","additionalProperties":false,"properties":{"audit_depth":{"enum":["initial","deep"],"type":"string"},"audit_outcome":{"enum":["completed","incomplete","no_actionable_hypothesis","no_supported_attack_surface"],"type":"string"},"budget":{"type":"object"},"coverage":{"type":"object"},"coverage_gaps":{"items":{"type":["object","string"]},"maxItems":4096,"type":"array"},"evidence_domain":{"type":"object"},"mining_eligible_hypothesis_ids":{"items":{"type":["object","string"]},"maxItems":4096,"type":"array"},"package_status":{"enum":["draft","sealed"],"type":"string"},"repository_profile_artifact_ids":{"items":{"type":["object","string"]},"maxItems":4096,"type":"array"},"revision":{"type":"integer"}},"required":["audit_depth","audit_outcome","budget","coverage","coverage_gaps","evidence_domain","mining_eligible_hypothesis_ids","package_status","repository_profile_artifact_ids","revision"],"title":"lima.audit-evidence-package","type":"object"}