{"audit_depth":"deep","audit_outcome":"completed","budget":{"model_calls":1,"model_tokens":12000,"tool_runs":3,"wall_clock_ms":45000},"coverage":{"analyzed_file_count":40,"in_scope_file_count":42},"coverage_gaps":[{"detail":"Bandit exceeded the per-file size budget for two vendored files.","gap_code":"TIER0_FILE_BUDGET_EXCEEDED"}],"evidence_domain":{"evidence":[{"analysis_family":"static-dataflow","depends_on_evidence_ids":["evidence-issue-0001"],"evidence_id":"evidence-hypothesis-0001","independence_key":"python-dataflow:cli-to-process","level":"D2","location":{"end_column":18,"end_line":10,"path":"src/example.py","start_column":5,"start_line":10,"symbol":"run_command"},"polarity":"supports","producer":"lima-python-dataflow","reason_codes":["SOURCE_TO_SINK_PATH"],"source_artifact_ids":["tool-run-0001"],"subject_id":"hypothesis-0001","subject_kind":"vulnerability_hypothesis","summary":"A deterministic source-to-sink path reaches process execution."},{"analysis_family":"contextual-analysis","depends_on_evidence_ids":["evidence-signal-0001"],"evidence_id":"evidence-issue-0001","independence_key":"cluster:command-injection:cli-to-process","level":"D1","location":{"end_column":18,"end_line":10,"path":"src/example.py","start_column":5,"start_line":10,"symbol":"run_command"},"polarity":"supports","producer":"lima-audit","reason_codes":["CONTEXT_APPLICABLE"],"source_artifact_ids":["tool-run-0001"],"subject_id":"issue-0001","subject_kind":"security_issue","summary":"The matched sink is in a CLI trust boundary."},{"analysis_family":"sast","depends_on_evidence_ids":[],"evidence_id":"evidence-signal-0001","independence_key":"bandit:B602:src/example.py:10","level":"D0","location":{"end_column":18,"end_line":10,"path":"src/example.py","start_column":5,"start_line":10,"symbol":"run_command"},"polarity":"supports","producer":"bandit-1.9.4","reason_codes":["RULE_MATCH"],"source_artifact_ids":["tool-run-0001"],"subject_id":"signal-0001","subject_kind":"signal","summary":"Bandit reported process execution with shell semantics."}],"security_issues":[{"cwe_ids":["CWE-78"],"evidence_ids":["evidence-issue-0001"],"identity_digest":"2222222222222222222222222222222222222222222222222222222222222222","issue_id":"issue-0001","primary_location":{"end_column":18,"end_line":10,"path":"src/example.py","start_column":5,"start_line":10,"symbol":"run_command"},"reason_codes":["ROOT_CAUSE_CLUSTERED_BY_SINK"],"root_cause_class":"command-injection","signal_ids":["signal-0001"],"sink_identity":"python.subprocess.shell","trust_boundary":"cli-to-process"}],"signals":[{"analysis_family":"sast","cwe_ids":["CWE-78"],"evidence_ids":["evidence-signal-0001"],"evidence_kind":"tool-observation","fingerprint":"1111111111111111111111111111111111111111111111111111111111111111","location":{"end_column":18,"end_line":10,"path":"src/example.py","start_column":5,"start_line":10,"symbol":"run_command"},"reason_codes":["RULE_MATCH_PROCESS_EXECUTION"],"rule_id":"B602","signal_id":"signal-0001"}],"vulnerability_hypotheses":[{"capability_requirements":["python","subprocess-observer"],"claim":"Untrusted CLI input may reach a process execution sink.","critical_path":[{"end_column":24,"end_line":20,"path":"src/cli.py","start_column":1,"start_line":20,"symbol":"main"},{"end_column":18,"end_line":10,"path":"src/example.py","start_column":5,"start_line":10,"symbol":"run_command"}],"cwe_ids":["CWE-78"],"evidence_ids":["evidence-hypothesis-0001"],"hypothesis_id":"hypothesis-0001","input_constraints":["argument contains shell metacharacters"],"issue_id":"issue-0001","reason_codes":["STATIC_DATAFLOW_REACHES_PROCESS_SINK"],"required_proof_kind":"runtime_behavior","security_invariant":"Process arguments must not be interpreted by a command shell.","source_locations":[{"end_column":24,"end_line":20,"path":"src/cli.py","start_column":1,"start_line":20,"symbol":"main"}],"status":"statically_supported","target_location":{"end_column":18,"end_line":10,"path":"src/example.py","start_column":5,"start_line":10,"symbol":"run_command"},"trigger_conditions":["attacker controls the CLI argument"]}]},"mining_eligible_hypothesis_ids":["hypothesis-0001"],"package_status":"sealed","repository_profile_artifact_ids":["profile-0001"],"revision":1}